{
  "license": "https://www.apache.org/licenses/LICENSE-2.0",
  "$schema": "https://json-schema.org/draft/2020-12/schema",
  "$id": "https://w3id.org/battinfo/schema/current-collector-spec.schema.json",
  "title": "BattINFO Current Collector Spec",
  "description": "Reusable current collector specification. The 'spec' half of the current-collector-spec + current-collector pair.",
  "type": "object",
  "additionalProperties": false,
  "required": [
    "schema_version",
    "current_collector_spec",
    "provenance"
  ],
  "properties": {
    "schema_version": {
      "type": "string",
      "pattern": "^\\d+\\.\\d+\\.\\d+(-[A-Za-z0-9.-]+)?$",
      "description": "Version of the record schema this document conforms to (semantic versioning); stamped by the library on save."
    },
    "current_collector_spec": {
      "type": "object",
      "additionalProperties": false,
      "required": [
        "id",
        "name"
      ],
      "properties": {
        "id": {
          "$ref": "#/$defs/ComponentSpecIri"
        },
        "short_id": {
          "$ref": "#/$defs/ShortId"
        },
        "name": {
          "type": "string",
          "minLength": 1,
          "description": "Product label of this current-collector design (e.g. 'Al foil 15 um')."
        },
        "handle": {
          "$ref": "#/$defs/Handle",
          "description": "Short readable slug, unique within one registry workspace (e.g. 'flores-ocv/graphite-aq-1-063b77-cell'). Display text, never part of the identity."
        },
        "material": {
          "type": "string",
          "minLength": 1,
          "description": "Substrate material of the current collector (e.g. 'Al', 'Cu', 'Ni', 'stainless steel', 'carbon-coated Al')."
        },
        "form": {
          "type": "string",
          "enum": [
            "foil",
            "mesh",
            "foam",
            "perforated",
            "other"
          ],
          "description": "Physical form of the current collector."
        },
        "material_spec_id": {
          "type": "string",
          "pattern": "^https://w3id\\.org/battinfo/(?:spec|material-spec|electrode-spec|separator-spec|electrolyte-spec|current-collector-spec|housing-spec)/[0-9a-hjkmnp-tv-z]{4}(?:-[0-9a-hjkmnp-tv-z]{4}){3}$"
        },
        "property": {
          "$ref": "modules/common/quantitative-properties.schema.json",
          "description": "Named quantity map of current-collector properties (e.g. thickness, areal_mass, width). See the property keys reference for the full list of recognised keys."
        },
        "manufacturer": {
          "$ref": "#/$defs/OrgRef",
          "description": "Manufacturer of the item."
        },
        "supplier": {
          "$ref": "#/$defs/OrgRef",
          "description": "Supplier or vendor the item was sourced from."
        },
        "product_id": {
          "type": "string",
          "description": "Manufacturer or supplier product/grade identifier."
        },
        "comment": {
          "type": "string",
          "description": "Free-text comment."
        }
      },
      "description": "The current-collector design being specified."
    },
    "provenance": {
      "$ref": "#/$defs/Provenance",
      "description": "Where the information in this record came from: source type, file or URL, citation, and retrieval time."
    },
    "notes": {
      "type": "array",
      "items": {
        "type": "string"
      },
      "description": "Free-text notes carried with the record."
    }
  },
  "$defs": {
    "ComponentSpecIri": {
      "type": "string",
      "pattern": "^https://w3id\\.org/battinfo/(?:spec|material-spec|electrode-spec|separator-spec|electrolyte-spec|current-collector-spec|housing-spec)/[0-9a-hjkmnp-tv-z]{4}(?:-[0-9a-hjkmnp-tv-z]{4}){3}$"
    },
    "ShortId": {
      "type": "string",
      "pattern": "^[0-9a-hjkmnp-tv-z]{6,16}$",
      "description": "Short human-friendly identifier derived from the record IRI (Crockford base32, 6-16 characters)."
    },
    "Handle": {
      "type": "string",
      "pattern": "^[a-z0-9]+(?:-[a-z0-9]+)*(?:/[a-z0-9]+(?:-[a-z0-9]+)*)*$",
      "maxLength": 120,
      "description": "Short readable slug for this record, unique within one registry workspace and shown as <workspace>/<handle> (e.g. 'flores-ocv/graphite-aq-1-063b77-cell'). Lowercase ASCII segments joined by '/', each made of letters and digits separated by single hyphens; at most 120 characters. Display text only: the record's identity is its IRI, and a handle may be corrected without moving it. Build one with battinfo.naming.handle_for()."
    },
    "UnixTime": {
      "type": "integer",
      "minimum": 0,
      "description": "Unix timestamp in whole seconds since 1970-01-01T00:00:00Z."
    },
    "OrganizationIri": {
      "type": "string",
      "pattern": "^https://w3id\\.org/battinfo/organization/[0-9a-hjkmnp-tv-z]{4}(?:-[0-9a-hjkmnp-tv-z]{4}){3}$",
      "description": "Canonical BattINFO IRI in the organization/ namespace (https://w3id.org/battinfo/organization/xxxx-xxxx-xxxx-xxxx)."
    },
    "Organization": {
      "type": "object",
      "additionalProperties": false,
      "required": [
        "name"
      ],
      "properties": {
        "type": {
          "const": "Organization",
          "description": "JSON-LD type discriminator."
        },
        "id": {
          "$ref": "#/$defs/OrganizationIri",
          "description": "Canonical BattINFO organization IRI linking this party to its organization record."
        },
        "name": {
          "type": "string",
          "minLength": 1,
          "description": "Organization name."
        },
        "url": {
          "type": "string",
          "format": "uri",
          "description": "Homepage URL."
        },
        "same_as": {
          "type": "string",
          "format": "uri",
          "description": "External identifier IRI for this organization (e.g. ROR or Wikidata)."
        }
      },
      "description": "An organization referenced by name, with an optional canonical BattINFO organization IRI."
    },
    "OrgRef": {
      "oneOf": [
        {
          "type": "string",
          "minLength": 1
        },
        {
          "$ref": "#/$defs/Organization"
        }
      ],
      "description": "An organization, as either a plain name string or a structured Organization object that can carry a canonical organization IRI."
    },
    "Provenance": {
      "type": "object",
      "additionalProperties": false,
      "required": [
        "source_type"
      ],
      "properties": {
        "source_type": {
          "type": "string",
          "enum": [
            "datasheet",
            "manufacturer",
            "measurement",
            "lab",
            "literature",
            "manual",
            "other"
          ],
          "description": "Kind of source this record was created from."
        },
        "source_name": {
          "type": "string",
          "description": "Human-readable name of the source (document title, instrument, lab, or system)."
        },
        "source_file": {
          "type": "string",
          "description": "Filename or path of the source file, when the record was derived from a file."
        },
        "source_url": {
          "oneOf": [
            {
              "type": "string",
              "format": "uri"
            },
            {
              "type": "null"
            }
          ],
          "description": "URL of the source document or landing page, when available."
        },
        "citation": {
          "type": "string",
          "format": "uri",
          "description": "Resolvable citation target to use for attribution, typically a DOI URL."
        },
        "citation_doi": {
          "type": "string",
          "pattern": "^10\\.\\d{4,9}/[-._;()/:A-Za-z0-9]+$",
          "description": "DOI of the source publication (bare '10.xxxx/...' form). Prefer provenance.citation with a DOI resolver URL."
        },
        "retrieved_at": {
          "$ref": "#/$defs/UnixTime",
          "description": "Unix timestamp (seconds since epoch, UTC) when the source was retrieved or the record was captured."
        },
        "battinfo_version": {
          "type": "string",
          "pattern": "^\\d+\\.\\d+\\.\\d+(((a|b|rc)\\d+)?(\\.post\\d+)?(\\.dev\\d+)?(\\+[A-Za-z0-9.]+)?|-[A-Za-z0-9.-]+)$",
          "description": "Version of the battinfo library that wrote this record, stamped on save: X.Y.Z with an optional PEP 440 suffix (0.8.0rc1, 0.8.0.dev1, 0.8.0.post1, 0.8.0+local) or a hyphenated one (0.8.0-rc1)."
        }
      },
      "description": "Where the information in this record came from: source type, file or URL, citation, and retrieval time."
    }
  }
}
